title;link;date;author_link;author
Информация по искусственному осеменению коров в 2024 году;https://www.chainsk.tom.ru/news/admrna/informacija_po_iskusstvennomu_osemeneniju_korov_v_2024_godu;29 декабря 2023;https://www.chainsk.tom.ru/news/admrna;Администрация Чаинского района
ОМВД России по Чаинскому району   приглашает жителей района и области на службу в органы внутренних дел;https://www.chainsk.tom.ru/news/admrna/omvd_rossii_po_chainskomu_rajonu_priglashaetzhitelejrajonaioblasti_na_sluzhbu_v_organy_vnutrennikh_del;29 декабря 2023;https://www.chainsk.tom.ru/news/admrna;Администрация Чаинского района
С Наступающим Новым годом!;https://www.chainsk.tom.ru/news/admrna/s_nastupajushhim_novym_godom;29 декабря 2023;https://www.chainsk.tom.ru/news/admrna;Администрация Чаинского района
ВСЕЙ СЕМЬЕЙ — ВСЕГДА ДРУЖНО И ВЕСЕЛО!;https://www.chainsk.tom.ru/news/admrna/vsej_semej_vsegda_druzhno_i_veselo;18 декабря 2023;https://www.chainsk.tom.ru/news/admrna;Администрация Чаинского района
Открыта переправа через речку Чая в селе Гришкино;https://www.chainsk.tom.ru/news/admrna/otkryta_pereprava_cherez_rechku_chaja_v_sele_grishkino;18 декабря 2023;https://www.chainsk.tom.ru/news/admrna;Администрация Чаинского района
Будьте осторожны с огнём!;https://www.chainsk.tom.ru/news/admrna/budte_ostorozhny_s_ognjom;13 декабря 2023;https://www.chainsk.tom.ru/news/admrna;Администрация Чаинского района
С Днём Конституции РФ!;https://www.chainsk.tom.ru/news/admrna/s_dnem_konstitucii_rf;12 декабря 2023;https://www.chainsk.tom.ru/news/admrna;Администрация Чаинского района
Открыта ледовая переправа Подгорное- Черёмушки;https://www.chainsk.tom.ru/news/admrna/otkryta_ledovaja_pereprava_podgornoe_cherjomushki;12 декабря 2023;https://www.chainsk.tom.ru/news/admrna;Администрация Чаинского района
Военная служба по контракту – работа настоящих мужчин;https://www.chainsk.tom.ru/news/admrna/voennajasluzhbapokontrakturabotanastojashhikhmuzhchin;11 декабря 2023;https://www.chainsk.tom.ru/news/admrna;Администрация Чаинского района
С Днём Героев Отечества;https://www.chainsk.tom.ru/news/admrna/s_dnjom_geroev_otechestva;09 декабря 2023;https://www.chainsk.tom.ru/news/admrna;Администрация Чаинского района
В Томской области завершилась профилактическая операция «Прицеп»;https://www.chainsk.tom.ru/news/admrna/v_tomskoj_oblasti_zavershilas_profilakticheskaja_operacija_pricep;07 декабря 2023;https://www.chainsk.tom.ru/news/admrna;Администрация Чаинского района
Важная информация;https://www.chainsk.tom.ru/news/admrna/vazhnaja_informacija;07 декабря 2023;https://www.chainsk.tom.ru/news/admrna;Администрация Чаинского района
С завтрашнего дня в Томской области ожидаются морозы;https://www.chainsk.tom.ru/news/admrna/s_zavtrashnego_dnja_v_tomskoj_oblasti_ozhidajutsja_morozy;07 декабря 2023;https://www.chainsk.tom.ru/news/admrna;Администрация Чаинского района
В Чаинском районе прошел День Департамента цифровой трансформации;https://www.chainsk.tom.ru/news/admrna/v_chainskom_rajone_proshel_den_departamenta_cifrovoj_transformacii;05 декабря 2023;https://www.chainsk.tom.ru/news/admrna;Администрация Чаинского района
День волонтерства;https://www.chainsk.tom.ru/news/admrna/den_volonterstva;05 декабря 2023;https://www.chainsk.tom.ru/news/admrna;Администрация Чаинского района
Тотальный тест «Доступная среда»;https://www.chainsk.tom.ru/news/admrna/totalnyj_test_dostupnaja_sreda;01 декабря 2023;https://www.chainsk.tom.ru/news/admrna;Администрация Чаинского района
В Томской области постановлен приговор по делу о контрабанде лесоматериалов стоимостью более 30 млн рублей;https://www.chainsk.tom.ru/news/admrna/v_tomskoj_oblasti_postanovlen_prigovor_po_delu_o_kontrabande_lesomaterialov_stoimostju_bolee_30_mln_rublej;27 ноября 2023;https://www.chainsk.tom.ru/news/admrna;Администрация Чаинского района
Публичные слушания;https://www.chainsk.tom.ru/news/admrna/publichnye_slushanija3;20 ноября 2023;https://www.chainsk.tom.ru/news/admrna;Администрация Чаинского района
Информация для организаций ЖКХ по эксплуатации самоходных машин в зимний период;https://www.chainsk.tom.ru/news/admrna/informacija_dlja_organizacij_zhkkh_po_ekspluatacii_samokhodnykh_mashin_v_zimnij_period;06 ноября 2023;https://www.chainsk.tom.ru/news/admrna;Администрация Чаинского района
В Томске воздушное судно вернулось в аэропорт вылета;https://www.chainsk.tom.ru/news/admrna/v_tomske_vozdushnoe_sudno_vernulos_v_aeroport_vyleta;30 октября 2023;https://www.chainsk.tom.ru/news/admrna;Администрация Чаинского района
"Клуб волонтёров ""Просто Доброе Дело"" приглашает всех неравнодушных жителей присоединиться к акции  «ПОДАРИ ТЕПЛО СОЛДАТУ!»";https://www.chainsk.tom.ru/news/admrna/klub_volontjorov_prosto_dobroe_delo_priglashaet_vsekh_neravnodushnykh_zhitelej_prisoedinitsja_k_akcii_podari_teplo_soldatu;17 октября 2023;https://www.chainsk.tom.ru/news/admrna;Администрация Чаинского района
В Томской области выберут лучших муниципальных служащих;https://www.chainsk.tom.ru/news/admrna/v_tomskoj_oblasti_vyberut_luchshikh_municipalnykh_sluzhashhikh;17 октября 2023;https://www.chainsk.tom.ru/news/admrna;Администрация Чаинского района
Управление Роспотребнадзора по Томской области проводит «горячую линию»;https://www.chainsk.tom.ru/news/admrna/upravlenie_rospotrebnadzora_po_tomskoj_oblasti_provodit_gorjachuju_liniju;06 октября 2023;https://www.chainsk.tom.ru/news/admrna;Администрация Чаинского района
Департамент по управлению государственной собственностью Томской области сообщает о проведении аукциона;https://www.chainsk.tom.ru/news/admrna/departament_po_upravleniju_gosudarstvennoj_sobstvennostju_tomskoj_oblasti_soobshhaet_o_provedenii_aukciona;03 октября 2023;https://www.chainsk.tom.ru/news/admrna;Администрация Чаинского района
"""Зарница""Всероссийских соревнований ВСИ"" Победа""";https://www.chainsk.tom.ru/news/admrna/zarnicavserossijskikh_sorevnovanij_vsi_pobeda;02 октября 2023;https://www.chainsk.tom.ru/news/admrna;Администрация Чаинского района
"В Томской области объявлен конкурс ""Лучший муниципальный служащий""";https://www.chainsk.tom.ru/news/admrna/v_tomskoj_oblasti_objavlen_konkurs_luchshij_municipalnyj_sluzhashhij;02 октября 2023;https://www.chainsk.tom.ru/news/admrna;Администрация Чаинского района
КРУГЛЫЙ СТОЛ ПО АКТУАЛЬНЫМ ВОПРОСАМ ОКАЗАНИЯ МЕТОДИЧЕСКОЙ ПОМОЩИ В ОРГАНИЗАЦИИ АНТИКОРРУПЦИОННОЙ РАБОТЫ;https://www.chainsk.tom.ru/news/admrna/kruglyj_stol_po_aktualnym_voprosam_okazanija_metodicheskoj_pomoshhi_v_organizacii_antikorrupcionnoj_raboty;15 сентября 2023;https://www.chainsk.tom.ru/news/admrna;Администрация Чаинского района
В результате вмешательства транспортного прокурора на мосту через реку Томь обеспечена установка знаков навигационного оборудования;https://www.chainsk.tom.ru/news/admrna/v_rezultate_vmeshatelstva_transportnogo_prokurora_na_mostu_cherez_reku_tom_obespechena_ustanovka_znakov_navigacionnogo_oborudovanija;08 сентября 2023;https://www.chainsk.tom.ru/news/admrna;Администрация Чаинского района
Извещение о размещении проекта отчета об определении кадастровой стоимости объектов капитального строительства, помещений, машино-мест и иных видов об;https://www.chainsk.tom.ru/news/admrna/izveshhenie_o_razmeshhenii_proekta_otcheta_ob_opredelenii_kadastrovoj_stoimosti_obektov_kapitalnogo_stroitelstva_pomeshhenij_mashinomest_i_inykh_vidov;06 сентября 2023;https://www.chainsk.tom.ru/news/admrna;Администрация Чаинского района
В Томской области транспортная прокуратура направила в суд уголовное дело о контрабанде пиломатериалов стоимостью более 22 млн рублей;https://www.chainsk.tom.ru/news/admrna/v_tomskoj_oblasti_transportnaja_prokuratura_napravila_v_sud_ugolovnoe_delo_o_kontrabande_pilomaterialov_stoimostju_bolee_22_mln_rublej;05 сентября 2023;https://www.chainsk.tom.ru/news/admrna;Администрация Чаинского района
В Томской области в суд направлено уголовное дело о нарушении правил безопасности движения и эксплуатации воздушного транспорта, повлекших причинение ;https://www.chainsk.tom.ru/news/admrna/v_tomskoj_oblasti_v_sud_napravleno_ugolovnoe_delo_o_narushenii_pravil_bezopasnosti_dvizhenija_i_ekspluatacii_vozdushnogo_transporta_povlekshikh_prichi;25 августа 2023;https://www.chainsk.tom.ru/news/admrna;Администрация Чаинского района
Томской транспортной прокуратурой приняты меры по организации транспортного сообщения между населенными пунктами в Парабельском районе Томской области;https://www.chainsk.tom.ru/news/admrna/tomskoj_transportnoj_prokuraturoj_prinjaty_mery_po_organizacii_transportnogo_soobshhenija_mezhdu_naselennymi_punktami_v_parabelskom_rajone_tomskoj_obl;18 августа 2023;https://www.chainsk.tom.ru/news/admrna;Администрация Чаинского района
Транспортной прокуратурой осуществляются надзорные мероприятия в связи задержками авиарейсов в аэропорту Томска;https://www.chainsk.tom.ru/news/admrna/transportnoj_prokuraturoj_osushhestvljajutsja_nadzornye_meroprijatija_v_svjazi_zaderzhkami_aviarejsov_v_aeroportu_tomska;14 августа 2023;https://www.chainsk.tom.ru/news/admrna;Администрация Чаинского района
Областные депутаты держат ответ перед избирателями;https://www.chainsk.tom.ru/news/admrna/oblastnye_deputaty_derzhat_otvet_pered_izbirateljami;10 августа 2023;https://www.chainsk.tom.ru/news/admrna;Администрация Чаинского района
Памятка о мерах пожарной безопасности в быту для частных жилых домов;https://www.chainsk.tom.ru/news/admrna/pamjatka_o_merakh_pozharnoj_bezopasnosti_v_bytu_dlja_chastnykh_zhilykh_domov;10 августа 2023;https://www.chainsk.tom.ru/news/admrna;Администрация Чаинского района
Информация по искусственному осеменению коров в 2023 году;https://www.chainsk.tom.ru/news/admrna/informacija_po_iskusstvennomu_osemeneniju_korov_v_2023_godu1;04 августа 2023;https://www.chainsk.tom.ru/news/admrna;Администрация Чаинского района
Памятка «Профилактика жестокого обращения с пожилыми людьми и инвалидами»;https://www.chainsk.tom.ru/news/admrna/pamjatka_profilaktika_zhestokogo_obrashhenija_s_pozhilymi_ljudmi_i_invalidami;01 августа 2023;https://www.chainsk.tom.ru/news/admrna;Администрация Чаинского района
Объявлен отбор на субсидию;https://www.chainsk.tom.ru/news/admrna/objavlen_otbor_na_subsidiju1;24 июля 2023;https://www.chainsk.tom.ru/news/admrna;Администрация Чаинского района
Собрание с управляющими и жильцами многоквартирных домов по поводу подготовки к отопительному сезону;https://www.chainsk.tom.ru/news/admrna/sobranie_s_upravljajushhimi_i_zhilcami_mnogokvartirnykh_domov_po_povodu_podgotovki_k_otopitelnomu_sezonu;13 июля 2023;https://www.chainsk.tom.ru/news/admrna;Администрация Чаинского района
Томской транспортной прокуратурой проведены надзорные мероприятия;https://www.chainsk.tom.ru/news/admrna/tomskoj_transportnoj_prokuraturoj_provedeny_nadzornye_meroprijatija;13 июля 2023;https://www.chainsk.tom.ru/news/admrna;Администрация Чаинского района
Администрация Чаинского района информирует о безопасности на воде;https://www.chainsk.tom.ru/news/admrna/administracija_chainskogo_rajona_informiruet_o_bezopasnosti_na_vode;10 июля 2023;https://www.chainsk.tom.ru/news/admrna;Администрация Чаинского района
Публичные слушания по рассмотрению проекта решения Думы Чаинского района Томской области  «О внесении изменений в Устав муниципального образования «Ча;https://www.chainsk.tom.ru/news/admrna/publichnye_slushanija_po_rassmotreniju_proekta_reshenija_dumy_chainskogo_rajona_tomskoj_oblasti_o_vnesenii_izmenenij_v_ustav_municipalnogo_obrazovanij;23 июня 2023;https://www.chainsk.tom.ru/news/admrna;Администрация Чаинского района
в с. Подгорное почтили память погибших в годы Великой Отечественной войны;https://www.chainsk.tom.ru/news/admrna/v_s_podgornoe_pochtili_pamjat_pogibshikh_v_gody_velikoj_otechestvennoj_vojny;22 июня 2023;https://www.chainsk.tom.ru/news/admrna;Администрация Чаинского района
Гостехнадзор Томской области в социальных сетях;https://www.chainsk.tom.ru/news/admrna/gostekhnadzor_tomskoj_oblasti_v_socialnykh_setjakh;22 июня 2023;https://www.chainsk.tom.ru/news/admrna;Администрация Чаинского района
Международный день привлечения внимания к железнодорожным переездам;https://www.chainsk.tom.ru/news/admrna/mezhdunarodnyj_den_privlechenija_vnimanija_k_zheleznodorozhnym_pereezdam;09 июня 2023;https://www.chainsk.tom.ru/news/admrna;Администрация Чаинского района
О безопасной эксплуатации нестационарных аттракционов;https://www.chainsk.tom.ru/news/admrna/o_bezopasnoj_ekspluatacii_nestacionarnykh_attrakcionov;31 мая 2023;https://www.chainsk.tom.ru/news/admrna;Администрация Чаинского района
Особый противопожарный режим в Томской области;https://www.chainsk.tom.ru/news/admrna/osobyj_protivopozharnyj_rezhim_v_tomskoj_oblasti;18 мая 2023;https://www.chainsk.tom.ru/news/admrna;Администрация Чаинского района
ВНИМАНИЕ! ОСОБЫЙ ПРОТИВОПОЖАРНЫЙ РЕЖИМ;https://www.chainsk.tom.ru/news/admrna/vnimanie_osobyj_protivopozharnyj_rezhim;17 мая 2023;https://www.chainsk.tom.ru/news/admrna;Администрация Чаинского района
Памятки населению;https://www.chainsk.tom.ru/news/admrna/pamjatki_naseleniju;10 мая 2023;https://www.chainsk.tom.ru/news/admrna;Администрация Чаинского района
Об установлении особого противопожарного режима на территории Томской области;https://www.chainsk.tom.ru/news/admrna/ob_ustanovlenii_osobogo_protivopozharnogo_rezhima_na_territorii_tomskoj_oblasti;10 мая 2023;https://www.chainsk.tom.ru/news/admrna;Администрация Чаинского района
Победа в сердце каждого;https://www.chainsk.tom.ru/news/admrna/pobeda_v_serdce_kazhdogo;05 мая 2023;https://www.chainsk.tom.ru/news/admrna;Администрация Чаинского района
Особый противопожарный режим;https://www.chainsk.tom.ru/news/admrna/osobyj_protivopozharnyj_rezhim;04 мая 2023;https://www.chainsk.tom.ru/news/admrna;Администрация Чаинского района
Бессмертный полк в новом формате;https://www.chainsk.tom.ru/news/admrna/bessmertnyj_polk_v_novom_formate;03 мая 2023;https://www.chainsk.tom.ru/news/admrna;Администрация Чаинского района
О торжественных церемониях чествования юбиляров супружеской жизни;https://www.chainsk.tom.ru/news/admrna/o_torzhestvennykh_ceremonijakh_chestvovanija_jubiljarov_supruzheskoj_zhizni;24 апреля 2023;https://www.chainsk.tom.ru/news/admrna;Администрация Чаинского района
Стартовало рейтинговое голосование в рамках нацпроекта «Жильё и городская среда»;https://www.chainsk.tom.ru/news/admrna/startovalo_rejtingovoe_golosovanie_v_ramkakh_nacproekta_zhiljo_i_gorodskaja_sreda;17 апреля 2023;https://www.chainsk.tom.ru/news/admrna;Администрация Чаинского района
Администрация Чаинского района информирует о поступлении на военную службу по контракту;https://www.chainsk.tom.ru/news/admrna/administracija_chainskogo_rajona_informiruet;14 апреля 2023;https://www.chainsk.tom.ru/news/admrna;Администрация Чаинского района
Новые школьные автобусы в Чаинский район!;https://www.chainsk.tom.ru/news/admrna/novye_shkolnye_avtobusy_v_chainskij_rajon;11 апреля 2023;https://www.chainsk.tom.ru/news/admrna;Администрация Чаинского района
Информация об установлении публичного сервитута;https://www.chainsk.tom.ru/news/admrna/informacija_ob_ustanovlenii_publichnogo_servituta;10 апреля 2023;https://www.chainsk.tom.ru/news/admrna;Администрация Чаинского района
В Томской области начинается профилактическая операция «Трактор»;https://www.chainsk.tom.ru/news/admrna/v_tomskoj_oblasti_nachinaetsja_profilakticheskaja_operacija_traktor;07 апреля 2023;https://www.chainsk.tom.ru/news/admrna;Администрация Чаинского района
В Томской области начинается профилактическая операция «Аттракцион»;https://www.chainsk.tom.ru/news/admrna/v_tomskoj_oblasti_nachinaetsja_profilakticheskaja_operacija_attrakcion;07 апреля 2023;https://www.chainsk.tom.ru/news/admrna;Администрация Чаинского района
Публичные слушания;https://www.chainsk.tom.ru/news/admrna/publichnye_slushanija2;05 апреля 2023;https://www.chainsk.tom.ru/news/admrna;Администрация Чаинского района
Военная служба по контракту - твой выбор!;https://www.chainsk.tom.ru/news/admrna/voennaja_sluzhba_po_kontraktu_tvoj_vybor1;04 апреля 2023;https://www.chainsk.tom.ru/news/admrna;Администрация Чаинского района
Год педагога и наставника;https://www.chainsk.tom.ru/news/admrna/god_pedagoga_i_nastavnika;30 марта 2023;https://www.chainsk.tom.ru/news/admrna;Администрация Чаинского района
Вступление в должность Главы Чаинского района;https://www.chainsk.tom.ru/news/admrna/vstuplenie_v_dolzhnost_glavy_chainskogo_rajona;27 марта 2023;https://www.chainsk.tom.ru/news/admrna;Администрация Чаинского района
Приглашаем на концерт;https://www.chainsk.tom.ru/news/admrna/priglashaem_na_koncert;21 марта 2023;https://www.chainsk.tom.ru/news/admrna;Администрация Чаинского района
Военная служба по контракту - твой выбор!;https://www.chainsk.tom.ru/news/admrna/voennaja_sluzhba_po_kontraktu_tvoj_vybor;17 марта 2023;https://www.chainsk.tom.ru/news/admrna;Администрация Чаинского района
Сегодня 16 марта на 40 заседании Думы Чаинского района избран Глава Чаинского района;https://www.chainsk.tom.ru/news/admrna/segodnja_16_marta_na_40_zasedanii_dumy_chainskogo_rajona_izbran_glava_chainskogo_rajona;16 марта 2023;https://www.chainsk.tom.ru/news/admrna;Администрация Чаинского района
В Администрацию Чаинского района требуется специалист (юрисконсульт);https://www.chainsk.tom.ru/news/admrna/v_administraciju_chainskogo_rajona_trebuetsja_specialist_juriskonsult;15 марта 2023;https://www.chainsk.tom.ru/news/admrna;Администрация Чаинского района
УВЕДОМЛЕНИЕ о проведении общественных обсуждений (в форме письменного опроса) по объекту государственной экологической экспертизы «Материалы, обосновы;https://www.chainsk.tom.ru/news/admrna/uvedomlenie_o_provedenii_obshhestvennykh_obsuzhdenij_v_forme_pismennogo_oprosa_po_obektu_gosudarstvennoj_ekologicheskoj_ekspertizy_materialy_obosnovyv;13 марта 2023;https://www.chainsk.tom.ru/news/admrna;Администрация Чаинского района
9 марта 2023 года состоялось заседание  конкурсной комиссии по избранию Главы Чаинского района;https://www.chainsk.tom.ru/news/admrna/9_marta_2023_goda_sostojalos_zasedanie_konkursnoj_komissii_po_izbraniju_glavy_chainskogo_rajona;09 марта 2023;https://www.chainsk.tom.ru/news/admrna;Администрация Чаинского района
В Администрации Чаинского района прошло предварительное заседание конкурсной комиссии по отбору кандидатур на должность Главы Чаинского района;https://www.chainsk.tom.ru/news/admrna/v_administracii_chainskogo_rajona_proshlo_predvaritelnoe_zasedanie_konkursnoj_komissii_po_otboru_kandidatur_na_dolzhnost_glavy_chainskogo_rajona;03 марта 2023;https://www.chainsk.tom.ru/news/admrna;Администрация Чаинского района
Приложение для мобильных устройств «МЧС России»;https://www.chainsk.tom.ru/news/admrna/prilozhenie_dlja_mobilnykh_ustrojstv_mchs_rossii;02 марта 2023;https://www.chainsk.tom.ru/news/admrna;Администрация Чаинского района
Изменился телефонный номер Единого контакт-центра взаимодействия с гражданами;https://www.chainsk.tom.ru/news/admrna/izmenilsja_telefonnyj_nomer_edinogo_kontaktcentra_vzaimodejstvija_s_grazhdanami;02 марта 2023;https://www.chainsk.tom.ru/news/admrna;Администрация Чаинского района
Мораторий на внеплановые проверки продлен на 2023 год;https://www.chainsk.tom.ru/news/admrna/moratorij_na_vneplanovye_proverki_prodlen_na_2023_god;14 февраля 2023;https://www.chainsk.tom.ru/news/admrna;Администрация Чаинского района
